{
  "evidence": {
    "artifacts": {
      "amd_secure_processor_state": {
        "ccp_access_failure": false,
        "psp_enabled": false,
        "source": "current-boot kernel journal",
        "state": "not-observed",
        "tee_enabled": false
      },
      "boot_file_hashes": [],
      "conventional_uefi_collection": {
        "applicable": true,
        "checks": [
          {
            "collection_state": "partial",
            "dasharo_feature": "SPI controller and chipset write protections",
            "evidence_ids": [
              "fwupd_security_json",
              "fwupd_security_text",
              "fwupd_bios_settings_json",
              "artifact:firmware_attributes"
            ],
            "evidence_states": {
              "artifact:firmware_attributes": "collected_empty",
              "fwupd_bios_settings_json": "not_collected",
              "fwupd_security_json": "collected",
              "fwupd_security_text": "collected"
            },
            "id": "firmware-write-resistance",
            "limitation": "Linux-only collection does not test an external hardware write-protect pin or attempt a flash write.",
            "purpose": "Collect evidence about whether privileged software can rewrite critical firmware regions.",
            "sources": [
              "fwupd HSI",
              "Linux firmware attributes"
            ],
            "title": "Firmware write resistance"
          },
          {
            "collection_state": "partial",
            "dasharo_feature": "Hardware-protected flash region",
            "evidence_ids": [
              "fwupd_security_json",
              "fwupd_devices_json"
            ],
            "evidence_states": {
              "fwupd_devices_json": "not_collected",
              "fwupd_security_json": "collected"
            },
            "id": "hardware-flash-protection",
            "limitation": "A hardware WP pin and external-programmer resistance cannot be proven from a normal Linux scan.",
            "purpose": "Preserve any Linux-visible evidence of protected flash regions and firmware update policy.",
            "sources": [
              "fwupd HSI",
              "fwupd device metadata"
            ],
            "title": "Hardware flash protection"
          },
          {
            "collection_state": "partial",
            "dasharo_feature": "Intel Boot Guard or equivalent verified boot",
            "evidence_ids": [
              "fwupd_security_json",
              "fwupd_security_text",
              "lscpu_json",
              "dmidecode_bios"
            ],
            "evidence_states": {
              "dmidecode_bios": "collected",
              "fwupd_security_json": "collected",
              "fwupd_security_text": "collected",
              "lscpu_json": "not_collected"
            },
            "id": "hardware-verified-firmware-boot",
            "limitation": "The collector records fwupd/kernel-visible state; it does not independently inspect fused keys.",
            "purpose": "Collect CPU-vendor and fwupd evidence for Intel Boot Guard or AMD Platform Secure Boot.",
            "sources": [
              "fwupd HSI",
              "SMBIOS",
              "lscpu"
            ],
            "title": "Hardware-verified firmware boot"
          },
          {
            "collection_state": "partial",
            "dasharo_feature": "Measured boot",
            "evidence_ids": [
              "tpm_properties",
              "tpm_algorithms",
              "tpm_pcrs",
              "tpm_eventlog",
              "artifact:tpm_eventlog",
              "fwupd_security_json"
            ],
            "evidence_states": {
              "artifact:tpm_eventlog": "collected_empty",
              "fwupd_security_json": "collected",
              "tpm_algorithms": "not_collected",
              "tpm_eventlog": "not_collected",
              "tpm_pcrs": "not_collected",
              "tpm_properties": "collected"
            },
            "id": "measured-boot",
            "limitation": "PCR values require event-log replay or external attestation before they become integrity conclusions.",
            "purpose": "Collect TPM capabilities, PCR banks, and the binary and parsed measured-boot event log.",
            "sources": [
              "Linux TPM resource manager",
              "tpm2-tools",
              "fwupd HSI"
            ],
            "title": "TPM measured boot"
          },
          {
            "collection_state": "partial",
            "dasharo_feature": "Secure Boot",
            "evidence_ids": [
              "secure_boot_state",
              "mok_pk",
              "mok_kek",
              "mok_db",
              "mok_dbx",
              "mok_enrolled",
              "efibootmgr",
              "bootctl",
              "kernel_lockdown",
              "efi_platform_size",
              "artifact:efi_variables"
            ],
            "evidence_states": {
              "artifact:efi_variables": "collected_empty",
              "bootctl": "not_collected",
              "efi_platform_size": "not_collected",
              "efibootmgr": "not_collected",
              "kernel_lockdown": "not_collected",
              "mok_db": "not_collected",
              "mok_dbx": "not_collected",
              "mok_enrolled": "not_collected",
              "mok_kek": "not_collected",
              "mok_pk": "not_collected",
              "secure_boot_state": "collected"
            },
            "id": "uefi-secure-boot",
            "limitation": "Collection does not execute an unsigned boot component to test rejection.",
            "purpose": "Collect Secure Boot state, UEFI trust databases, boot entries, EFI variables, and kernel lockdown.",
            "sources": [
              "mokutil",
              "efivarfs",
              "efibootmgr",
              "systemd bootctl",
              "Linux lockdown"
            ],
            "title": "UEFI Secure Boot"
          },
          {
            "collection_state": "collected",
            "dasharo_feature": "SMM BIOS protection",
            "evidence_ids": [
              "fwupd_security_json",
              "fwupd_security_text"
            ],
            "evidence_states": {
              "fwupd_security_json": "collected",
              "fwupd_security_text": "collected"
            },
            "id": "smm-firmware-isolation",
            "limitation": "No CHIPSEC driver is loaded; low-level SMRAM and SMM code checks are outside this simple profile.",
            "purpose": "Collect fwupd HSI attributes related to SMM BIOS write protection and platform isolation.",
            "sources": [
              "fwupd HSI"
            ],
            "title": "SMM firmware isolation"
          },
          {
            "collection_state": "partial",
            "dasharo_feature": "Pre-boot DMA protection",
            "evidence_ids": [
              "fwupd_security_json",
              "iommu_kernel_log",
              "artifact:iommu_groups",
              "artifact:firmware_runtime_hashes"
            ],
            "evidence_states": {
              "artifact:firmware_runtime_hashes": "collected_empty",
              "artifact:iommu_groups": "collected_empty",
              "fwupd_security_json": "collected",
              "iommu_kernel_log": "not_collected"
            },
            "id": "early-dma-protection",
            "limitation": "Linux IOMMU activation alone does not prove protection was active before the OS started.",
            "purpose": "Collect fwupd pre-boot DMA attributes, ACPI tables, Linux IOMMU groups, and relevant kernel messages.",
            "sources": [
              "fwupd HSI",
              "Linux IOMMU sysfs",
              "kernel journal",
              "ACPI DMAR/IVRS"
            ],
            "title": "Early DMA protection"
          },
          {
            "collection_state": "partial",
            "dasharo_feature": "Signed firmware updates",
            "evidence_ids": [
              "fwupd_devices_json",
              "fwupd_updates_json",
              "fwupd_remotes_json",
              "fwupd_topology_json",
              "artifact:esrt_entries"
            ],
            "evidence_states": {
              "artifact:esrt_entries": "collected_empty",
              "fwupd_devices_json": "not_collected",
              "fwupd_remotes_json": "not_collected",
              "fwupd_topology_json": "not_collected",
              "fwupd_updates_json": "collected"
            },
            "id": "authenticated-firmware-updates",
            "limitation": "The scan does not install a deliberately invalid capsule to prove rejection.",
            "purpose": "Collect update-capable devices, release metadata, ESRT entries, and configured remotes.",
            "sources": [
              "fwupd",
              "Linux UEFI ESRT sysfs"
            ],
            "title": "Authenticated firmware updates"
          },
          {
            "collection_state": "partial",
            "dasharo_feature": "Firmware downgrade restrictions",
            "evidence_ids": [
              "fwupd_security_json",
              "fwupd_devices_json",
              "fwupd_bios_settings_json"
            ],
            "evidence_states": {
              "fwupd_bios_settings_json": "not_collected",
              "fwupd_devices_json": "not_collected",
              "fwupd_security_json": "collected"
            },
            "id": "rollback-protection",
            "limitation": "No downgrade is attempted; absence of metadata is not proof that downgrade protection is absent.",
            "purpose": "Preserve fwupd HSI, device flags, lowest-version metadata, and firmware-exposed BIOS settings.",
            "sources": [
              "fwupd HSI",
              "fwupd device metadata",
              "fwupd BIOS settings"
            ],
            "title": "Firmware rollback protection"
          },
          {